{
  "id": "front.eira-the-ashen-s-design",
  "kind": "front",
  "name": "Eira the Ashen's design",
  "drive": "Conquest — dominion over a land, people, or throne",
  "genre": "high",
  "owner": "villain.eira-the-ashen",
  "clock": {
    "size": 8,
    "filled": 0
  },
  "stage": 0,
  "telegraphs": [
    "rumors and distant signs of conquest — dominion over a land, people, or throne",
    "a visible move against an ally, place, or resource the heroes value",
    "open action — the threat strikes in the light of day",
    "the agenda nears completion; the world reels"
  ],
  "linked_entities": [
    "villain.eira-the-ashen"
  ],
  "resolved": false
}