{
  "id": "front.a-pilgrimage-or-quest-de",
  "kind": "front",
  "name": "a pilgrimage or quest demands a terrible sacrifice",
  "drive": "a pilgrimage or quest demands a terrible sacrifice",
  "genre": "high",
  "clock": {
    "size": 8,
    "filled": 0
  },
  "stage": 0,
  "telegraphs": [
    "rumors and distant signs of a pilgrimage or quest demands a terrible sacrifice",
    "a visible move against an ally, place, or resource the heroes value",
    "open action — the threat strikes in the light of day",
    "the agenda nears completion; the world reels"
  ],
  "linked_entities": [],
  "resolved": false
}